{
  "schemaVersion": 1,
  "id": "product-management.productization-package",
  "name": "Productization Package",
  "description": "A Product-owned handoff that packages validated POC outcomes, evidence, gaps, reuse decisions, risks, and source references for a formal Delivery Flow.",
  "ownerDomain": "product-management",
  "version": "1.0.0",
  "format": "markdown",
  "schemaRef": "schema.json",
  "profiles": ["default"],
  "defaultTemplate": "templates/default.md",
  "examples": ["examples/example-productization-package.md"]
}
